Id,Title,Author,Date,Link
284,True! Sierra Leone was elected as a non-permanent member of the...,Gloria Wleh -,"July 11, 2023",https://tsmliberia.com/true-sierra-leone-was-elected-as-a-non-permanent-member-of-the-un-security-council/
285,"Correct, Costa Got 8 Percent In 2017 Elections",R. Joyclyn Wea -,"July 11, 2023",https://tsmliberia.com/correct-costa-got-8-percent-in-2017-elections/
286,What Did Representative Foko Say about Weah’s One-Term Bid?,Mark Mengonfia -,"July 8, 2023",https://tsmliberia.com/what-did-representative-foko-say-about-weahs-one-term-bid/
287,The Post of Costa For President is Misleading,Mark Mengonfia -,"June 30, 2023",https://tsmliberia.com/the-post-of-costa-for-president-is-misleading/
288,Explainer: Why Justice Scott’s Motion to Admit to Bail Was Denied?,R. Joyclyn Wea -,"June 28, 2023",https://tsmliberia.com/explainer-why-justice-scotts-motion-to-admit-to-bail-was-denied/
